{
  "base_revision": "35afaca898eae6937066f230906b41af0e1f6690",
  "baseline_canonical_input_digest": "sha256:98e9dc4521e69ee5273e302fc40cc1e5fc3d53b119e2c7637475ac45cce43fbf",
  "baseline_path": "media/baselines/intelligence-stage-a.json",
  "baseline_schema_version": 2,
  "frozen_cohort": {
    "cohort_revision": "35afaca898eae6937066f230906b41af0e1f6690",
    "items": {
      "batman-2022": {
        "order_key": "sha256:6bd194b4ab25beb59cb6a5aa6626d93b9402f30a06ce675be84f92f380069577",
        "order_rank": 23,
        "pre_pilot_feedback_digest": "sha256:0e3913258589672abd2bdb1f00d479050160ba501418f6b1ca3b6c88cbfc0168",
        "stratum": "low",
        "viewing_status": "watched"
      },
      "blade-runner-2049-2017": {
        "order_key": "sha256:5a714df18e046ff6916866ae2a53a5463bc54ba612d680b70088df8e1979efa4",
        "order_rank": 19,
        "pre_pilot_feedback_digest": "sha256:7d87e4d7d218f6c666ff10d14f22601efc70d009f120e6a5308421f6c23aeced",
        "stratum": "low",
        "viewing_status": "watched"
      },
      "cast-away-2000": {
        "order_key": "sha256:2389938c502190362f4d26458627a62454690f648946e8d9b68c015108dcac06",
        "order_rank": 29,
        "pre_pilot_feedback_digest": "sha256:3904bc301d76eb22fcbb74f370f21a82947bab56599bfa8abbbbf7abb501a7f5",
        "stratum": "central",
        "viewing_status": "watched"
      },
      "catch-me-if-you-can-2002": {
        "order_key": "sha256:d300ce963cb9592a1aaa07c7d82da9c643ef8cf42f9d36c74bea5b3ec205d800",
        "order_rank": 53,
        "pre_pilot_feedback_digest": "sha256:3904bc301d76eb22fcbb74f370f21a82947bab56599bfa8abbbbf7abb501a7f5",
        "stratum": "central",
        "viewing_status": "watched"
      },
      "deja-vu-2006": {
        "order_key": "sha256:78468172aec40a52357d508104fc67d773ce477e9547a8e0dd54b2fdbaa9d56e",
        "order_rank": 24,
        "pre_pilot_feedback_digest": "sha256:c6e5233e0e008f10d5ab26a237c1b8fbb8304cb7ae4e61eee7534858826c5f82",
        "stratum": "medium_low",
        "viewing_status": "watched"
      },
      "district-9-2009": {
        "order_key": "sha256:7b6ef6cd180bd98157f07ccc5a0efe0cf50fb6f46693878c4386d11b06875514",
        "order_rank": 47,
        "pre_pilot_feedback_digest": "sha256:f06f5b330bc1b1f9869c6adefd330e3e9cb818074722486acba7eaa3bcf0f4eb",
        "stratum": "central",
        "viewing_status": "watched"
      },
      "dune-2021": {
        "order_key": "sha256:f7f1ab9b6afbeeadff8700bd243cde74b2e584ceb87d52443b173fda7d468b8d",
        "order_rank": 54,
        "pre_pilot_feedback_digest": "sha256:9a80ba663b759dacaf5e744837376417d473d388378f5f389125495f5106e8e2",
        "stratum": "central",
        "viewing_status": "watched"
      },
      "dune-part-two-2024": {
        "order_key": "sha256:9dcacb5fd1a4c7504bc6559a8c6349b5de7a84c9f3132cd2cff4d437c308fedd",
        "order_rank": 50,
        "pre_pilot_feedback_digest": "sha256:9a80ba663b759dacaf5e744837376417d473d388378f5f389125495f5106e8e2",
        "stratum": "central",
        "viewing_status": "watched"
      },
      "edge-of-tomorrow-2014": {
        "order_key": "sha256:8a2c7fe1473d41539b4e30fea05a6bf67bdbf95eea193194f33fed8b0c82d911",
        "order_rank": 30,
        "pre_pilot_feedback_digest": "sha256:4788fa6c131a5b548269fd455fa7a8b69d71ed79740755e9e206f5b207b77ef1",
        "stratum": "high",
        "viewing_status": "watched"
      },
      "equilibrium-2002": {
        "order_key": "sha256:83ea09e728103b87c937edf1b3122fde41324ac6133ff7279dc8692cfec13450",
        "order_rank": 22,
        "pre_pilot_feedback_digest": "sha256:0deb79eaf6b85e5a4bf1fc6c9107fc3d1f0312297930331fab71fa5a1e8f3f04",
        "stratum": "high",
        "viewing_status": "watched"
      },
      "event-horizon-1997": {
        "order_key": "sha256:25ee8168af8306940630fbd1b507d77cc7034051d71453201f81fab8fd1b0156",
        "order_rank": 16,
        "pre_pilot_feedback_digest": "sha256:61f92688748382169d1ad6889092a68bbc2d95402fe4be1edda7b38efb1417e6",
        "stratum": "medium_low",
        "viewing_status": "watched"
      },
      "fifth-element-1997": {
        "order_key": "sha256:4c858ae0016b82c9a5c8ee2550c37cfd41b09d11b8990cac784d99ff894429ef",
        "order_rank": 37,
        "pre_pilot_feedback_digest": "sha256:3904bc301d76eb22fcbb74f370f21a82947bab56599bfa8abbbbf7abb501a7f5",
        "stratum": "central",
        "viewing_status": "watched"
      },
      "ford-v-ferrari-2019": {
        "order_key": "sha256:8b6b5b120e6fbe3183f899d3f00c2ff437a0fb3787e596d77753b7af69892fe0",
        "order_rank": 48,
        "pre_pilot_feedback_digest": "sha256:ccd6077f748c6bef19ebbb8f3720ec56ecce30db9d40d03be1d51e29e0af4d1f",
        "stratum": "central",
        "viewing_status": "watched"
      },
      "furiosa-2024": {
        "order_key": "sha256:1deafd9db9fa35880da6e498e4105bc2033865ab3954d87995f1cd4de97288f1",
        "order_rank": 11,
        "pre_pilot_feedback_digest": "sha256:479241454b33a3e8affa840b15620b5b5bac8e6cf1afebaab7d2f656bf357941",
        "stratum": "low",
        "viewing_status": "watched"
      },
      "game-night-2018": {
        "order_key": "sha256:18c2e509b4b48db56e3ad9025f5d5b556e46795b9bc9535cc90b7e2638ccdf0d",
        "order_rank": 12,
        "pre_pilot_feedback_digest": "sha256:44cca043866f5b4db053924332e2f195381ab5bb08e7662d6892e09b912e134e",
        "stratum": "medium_low",
        "viewing_status": "watched"
      },
      "gattaca-1997": {
        "order_key": "sha256:a830b9c41f0f414348a40c9f53a3bdb7928f286020dbe79fb9938c7161050ef6",
        "order_rank": 0,
        "pre_pilot_feedback_digest": "sha256:c8e2ed0eab9c7967c43523708d8cf6ab1cd1f9dc6104c0a962c9e2e4ea919df9",
        "stratum": "special",
        "viewing_status": "forgotten"
      },
      "gentlemen-2019": {
        "order_key": "sha256:c2d3ac61b87eb537ca7e25c7b57ee956018d406e855bf040edc2cd74bc69f9ab",
        "order_rank": 5,
        "pre_pilot_feedback_digest": "sha256:e081273002ba2c7319b06a5ef05fbfced80e9324030d10ac05c00891014a7f80",
        "stratum": "special",
        "viewing_status": "dropped"
      },
      "gladiator-2000": {
        "order_key": "sha256:0d89b33dccd51b1c308eb2595bffb2fb680951e55889c1ba2c4f05e968d5a9da",
        "order_rank": 9,
        "pre_pilot_feedback_digest": "sha256:d79e67ed25fa2c761e32c7a3267a28928f640d3d3ff0df34cf5bace89587a3b5",
        "stratum": "high",
        "viewing_status": "watched"
      },
      "grand-budapest-hotel-2014": {
        "order_key": "sha256:037465b60b1cbd2f1655c99b268454b623de73d962e8fcace9ac12905812bca7",
        "order_rank": 1,
        "pre_pilot_feedback_digest": "sha256:ccedf3359d80dee06b2e94191c3d50eddedbf9a59bf05f9c720dd4e976ea9919",
        "stratum": "low",
        "viewing_status": "watched"
      },
      "green-book-2018": {
        "order_key": "sha256:11e222fd2c226addb7652a74aa33e78c17a9394bf23421c049add74d39e426e0",
        "order_rank": 17,
        "pre_pilot_feedback_digest": "sha256:3904bc301d76eb22fcbb74f370f21a82947bab56599bfa8abbbbf7abb501a7f5",
        "stratum": "central",
        "viewing_status": "watched"
      },
      "groundhog-day-1993": {
        "order_key": "sha256:0bf917c183955b69bc6f05c1a801828a665ffead6ed69be59e88717b24267837",
        "order_rank": 13,
        "pre_pilot_feedback_digest": "sha256:4dcf6e694e5a2403b233ca5d80f4a86dfcf88fd6354187371a2eb3f928f29b1d",
        "stratum": "central",
        "viewing_status": "watched"
      },
      "i-robot-2004": {
        "order_key": "sha256:677681401d78bae5e52fc0fa46ec328a0fbd58a8c405029ed29f6e8ac46a6b35",
        "order_rank": 45,
        "pre_pilot_feedback_digest": "sha256:f06f5b330bc1b1f9869c6adefd330e3e9cb818074722486acba7eaa3bcf0f4eb",
        "stratum": "central",
        "viewing_status": "watched"
      },
      "inglourious-basterds-2009": {
        "order_key": "sha256:c9a52e750514d3b878b457dcdab5c60dbe31793d84a8d123246b08c7bfd72856",
        "order_rank": 28,
        "pre_pilot_feedback_digest": "sha256:5d5fa7450a807d242a44645645a1e45b87f66bd198b902a04425abc2beaad5cc",
        "stratum": "medium_low",
        "viewing_status": "watched"
      },
      "interstellar-2014": {
        "order_key": "sha256:0138b38a61d587b2dff2ca465cb0c3cdcac7db6777f7fead4d0825a58cdc1ede",
        "order_rank": 4,
        "pre_pilot_feedback_digest": "sha256:6db005456b3e492311097dd5defccf967942404a016215b771af89363a579363",
        "stratum": "high",
        "viewing_status": "watched"
      },
      "intouchables-2011": {
        "order_key": "sha256:73aefbb4c4fc81be50983faf0cdd94bb70c516dc5a5144d90e1bb8b94389a97e",
        "order_rank": 46,
        "pre_pilot_feedback_digest": "sha256:3904bc301d76eb22fcbb74f370f21a82947bab56599bfa8abbbbf7abb501a7f5",
        "stratum": "central",
        "viewing_status": "watched"
      },
      "joker-2019": {
        "order_key": "sha256:1b17f85ac1e356bd9839ed3c9c3d8093a11a4539b800c214000e67fe74fac423",
        "order_rank": 21,
        "pre_pilot_feedback_digest": "sha256:3904bc301d76eb22fcbb74f370f21a82947bab56599bfa8abbbbf7abb501a7f5",
        "stratum": "central",
        "viewing_status": "watched"
      },
      "knives-out-2019": {
        "order_key": "sha256:ac2fb6abc138bfae598dede2044b8ce84bc7d4118946dc7c9d70487cc1ba6677",
        "order_rank": 38,
        "pre_pilot_feedback_digest": "sha256:27c098143614ac043e5a8344814f2ce0c8eed04b46eac9717095c0f6b4f2ff5f",
        "stratum": "high",
        "viewing_status": "watched"
      },
      "leon-1994": {
        "order_key": "sha256:5c54464ec3be764031de781fb0f2b8ac67dd71c569a21c096e0ce5558570720b",
        "order_rank": 42,
        "pre_pilot_feedback_digest": "sha256:3904bc301d76eb22fcbb74f370f21a82947bab56599bfa8abbbbf7abb501a7f5",
        "stratum": "central",
        "viewing_status": "watched"
      },
      "limitless-2011": {
        "order_key": "sha256:07f8d0a8b190b12992accc38093ab75e56b7c11ecc542e7a69c61e4d8f23d992",
        "order_rank": 8,